{
  "batchId": "mauritius-final-outbound-gaps-2026",
  "researchedAt": "2026-08-23",
  "sources": [
    {
      "id": "jordan-tourism-board-mauritius-voa-2026",
      "title": "Visas to Jordan: Mauritius",
      "url": "https://fr.visitjordan.com/page/4/visas-to-jordan/",
      "publisher": "Jordan Tourism Board",
      "jurisdiction": "Jordan",
      "kind": "government-guidance",
      "language": "English",
      "reviewedAt": "2026-08-23",
      "officialityEvidence": "Jordan Tourism Board identifies this as its official site; its live nationality table expressly names Mauritius.",
      "supportingExcerpt": "Mauritius Applicable Visa can be obtained upon arrival, it will cost a total of 40 JOD."
    }
  ],
  "policies": [
    {
      "id": "mauritius-ordinary-passport-jordan-visitor-voa-2026",
      "title": "Mauritian ordinary passports: Jordan visa on arrival",
      "summary": "Jordan's official Tourism Board table expressly states that Mauritian visitors can obtain a paid visa on arrival.",
      "status": "visa_on_arrival",
      "destinationCodes": ["JO"],
      "passportCodes": ["MU"],
      "conditions": [
        "The official table lists a 40-JOD arrival visa for Mauritius; its visitor guidance also requires Gateway2Jordan QR registration before departure.",
        "Passport validity, purpose, permitted ports, security screening and final admission remain applicable; work, residence and special documents are outside scope."
      ],
      "sourceIds": ["jordan-tourism-board-mauritius-voa-2026"],
      "confidence": "high"
    }
  ],
  "conflicts": [],
  "unresolved": [
    {"passportCode":"MU","destinationCode":"CV","reason":"Current Cabo Verde material does not publish a reconciled ordinary Mauritian issuance rule; EASE registration alone is not a visa category.","searchedOfficialDomains":["foreign.govmu.org","portalconsular.mnec.gov.cv","ease.gov.cv"]},
    {"passportCode":"MU","destinationCode":"CF","reason":"No current Central African authority establishes ordinary Mauritian visitor issuance timing; the Mauritian outbound PDF is insufficient alone.","searchedOfficialDomains":["foreign.govmu.org","diplomatie.gouv.cf","interieur.gouv.cf"]},
    {"passportCode":"MU","destinationCode":"KM","reason":"No current Comorian authority establishes ordinary Mauritian visitor issuance timing; the Mauritian PDF's arrival label is insufficient alone.","searchedOfficialDomains":["foreign.govmu.org","justice.gouv.km","egouv.km"]},
    {"passportCode":"MU","destinationCode":"CD","reason":"No current DRC nationality schedule reconciles ordinary Mauritian visitor issuance timing.","searchedOfficialDomains":["foreign.govmu.org","dgm.cd"]},
    {"passportCode":"MU","destinationCode":"CG","reason":"Current Congolese sources do not publish a nationality schedule that reconciles ordinary Mauritian visitor issuance timing.","searchedOfficialDomains":["foreign.govmu.org","diplomatie.gouv.cg","dgrsp.cg"]},
    {"passportCode":"MU","destinationCode":"CI","reason":"Ivorian online pre-enrolment ends with border sticker issuance and no current nationality schedule reconciles this ordinary Mauritian pair.","searchedOfficialDomains":["foreign.govmu.org","diplomatie.gouv.ci","snedai.com"]},
    {"passportCode":"MU","destinationCode":"DJ","reason":"Djibouti's live electronic service publishes no current ordinary Mauritian nationality schedule.","searchedOfficialDomains":["foreign.govmu.org","evisa.gouv.dj","egouv.dj"]},
    {"passportCode":"MU","destinationCode":"GW","reason":"No current Guinea-Bissau authority establishes ordinary Mauritian visitor issuance timing.","searchedOfficialDomains":["foreign.govmu.org","mne.gov.gw"]},
    {"passportCode":"MU","destinationCode":"LR","reason":"Liberia's conditional approval and arrival workflow does not publish an ordinary Mauritian nationality mapping.","searchedOfficialDomains":["foreign.govmu.org","immigration.gov.lr","mofa.gov.lr"]},
    {"passportCode":"MU","destinationCode":"ML","reason":"No current Malian authority establishes ordinary Mauritian visitor issuance timing.","searchedOfficialDomains":["foreign.govmu.org","diplomatiemdc.gouv.ml","securite.gouv.ml"]},
    {"passportCode":"MU","destinationCode":"NE","reason":"No current Nigerien authority establishes ordinary Mauritian visitor issuance timing.","searchedOfficialDomains":["foreign.govmu.org","diplomatie.gouv.ne","interieur.gouv.ne"]},
    {"passportCode":"MU","destinationCode":"ST","reason":"The live electronic service does not publish a current ordinary Mauritian eligibility schedule.","searchedOfficialDomains":["foreign.govmu.org","smf.gov.st","mne.gov.st"]},
    {"passportCode":"MU","destinationCode":"SL","reason":"Current Sierra Leone official material does not reconcile issuance timing for this ordinary-passport pair.","searchedOfficialDomains":["foreign.govmu.org","immigration.gov.sl","slid.gov.sl"]},
    {"passportCode":"MU","destinationCode":"SS","reason":"South Sudan's portal publishes no ordinary Mauritian nationality eligibility schedule.","searchedOfficialDomains":["foreign.govmu.org","evisa.gov.ss","mofaic.gov.ss"]},
    {"passportCode":"MU","destinationCode":"SD","reason":"No current Sudanese authority establishes ordinary Mauritian visitor issuance timing.","searchedOfficialDomains":["foreign.govmu.org","mofa.gov.sd","moi.gov.sd"]},
    {"passportCode":"MU","destinationCode":"TN","reason":"Current Tunisian authorities publish no ordinary-passport nationality schedule that reconciles this pair.","searchedOfficialDomains":["foreign.govmu.org","diplomatie.gov.tn","e-visa.tn"]},
    {"passportCode":"MU","destinationCode":"VG","reason":"Current territory material does not establish this ordinary-passport pair without relying on an outdated nationality schedule.","searchedOfficialDomains":["foreign.govmu.org","bvi.gov.vg"]},
    {"passportCode":"MU","destinationCode":"GD","reason":"Grenada's accessible official nationality schedule is dated February 2021 and does not establish currentness.","searchedOfficialDomains":["foreign.govmu.org","gov.gd","mofa.gov.gd"]},
    {"passportCode":"MU","destinationCode":"AF","reason":"No current destination authority establishes ordinary Mauritian visitor issuance timing; the Mauritian outbound PDF contains legacy material and is insufficient alone.","searchedOfficialDomains":["foreign.govmu.org","mfa.gov.af","moi.gov.af"]},
    {"passportCode":"MU","destinationCode":"BD","reason":"No current Bangladesh authority reconciles ordinary Mauritian eligibility and issuance timing.","searchedOfficialDomains":["foreign.govmu.org","mofa.gov.bd","evisa.gov.bd"]},
    {"passportCode":"MU","destinationCode":"KG","reason":"Current Kyrgyz positive lists and portal behaviour do not reproducibly establish ordinary Mauritian eligibility.","searchedOfficialDomains":["foreign.govmu.org","mfa.gov.kg","evisa.e-gov.kg"]},
    {"passportCode":"MU","destinationCode":"KP","reason":"No current DPRK authority establishes a usable ordinary Mauritian short-visitor issuance route; operational restrictions are not normalized as a visa category.","searchedOfficialDomains":["foreign.govmu.org","mfa.gov.kp","naenara.com.kp"]},
    {"passportCode":"MU","destinationCode":"TM","reason":"Current Turkmen material does not distinguish ordinary Mauritian visitor issuance from invitation-dependent processing.","searchedOfficialDomains":["foreign.govmu.org","mfa.gov.tm","migration.gov.tm"]},
    {"passportCode":"MU","destinationCode":"MK","reason":"North Macedonia's official selector was not reproducible, and the Mauritian PDF does not independently establish a short-stay exemption.","searchedOfficialDomains":["foreign.govmu.org","mfa.gov.mk","mvr.gov.mk"]},
    {"passportCode":"MU","destinationCode":"IQ","reason":"Iraq's federal eVisa nationality endpoint does not publish a usable ordinary Mauritian eligibility result.","searchedOfficialDomains":["foreign.govmu.org","mofa.gov.iq","evisa.iq"]},
    {"passportCode":"MU","destinationCode":"KW","reason":"Kuwait's mutable eligibility service does not establish a reproducible ordinary Mauritian visitor route; residence conditions are excluded.","searchedOfficialDomains":["foreign.govmu.org","moi.gov.kw","e.gov.kw"]},
    {"passportCode":"MU","destinationCode":"PS","reason":"Neither side's current material resolves Israeli crossing controls as a Palestinian-destination ordinary-visitor taxonomy.","searchedOfficialDomains":["foreign.govmu.org","mfae.gov.ps","gov.il","cogat.mod.gov.il"]},
    {"passportCode":"MU","destinationCode":"SY","reason":"No current Syrian authority establishes ordinary Mauritian electronic eligibility and issuance timing.","searchedOfficialDomains":["foreign.govmu.org","mofaex.gov.sy","moi.gov.sy"]},
    {"passportCode":"MU","destinationCode":"SB","reason":"No current Solomon Islands authority establishes ordinary Mauritian visitor issuance timing.","searchedOfficialDomains":["foreign.govmu.org","mfaet.gov.sb","immigration.gov.sb"]}
  ]
}
