{
  "batchId": "panama-dprk-visa-and-near-complete-holds-2026",
  "researchedAt": "2026-08-26",
  "sources": [
    {
      "id": "panama-embassy-live-authorized-visa-schedule-2026",
      "title": "Immigration and visas: Authorized Visas schedule",
      "url": "https://www.embassyofpanama.org/visas-1",
      "publisher": "Embassy of Panama in the United States",
      "jurisdiction": "Panama",
      "kind": "government-guidance",
      "language": "English",
      "reviewedAt": "2026-08-26",
      "officialityEvidence": "The live site identifies itself as the official website of Panama's Embassy in the United States and publishes its Washington consular address and visitor-visa requirements.",
      "supportingExcerpt": "People's Republic of Korea"
    },
    {
      "id": "panama-mire-authorized-visa-preauthorization-2026",
      "title": "Consular services: processing stamped and authorized visas",
      "url": "https://mire.gob.pa/servicios-consulares/",
      "publisher": "Ministerio de Relaciones Exteriores",
      "jurisdiction": "Panama",
      "kind": "government-guidance",
      "language": "Spanish",
      "reviewedAt": "2026-08-26",
      "officialityEvidence": "Panama's Foreign Ministry directly defines the authorized-visa procedure and the Migration Service approval required before the consul may issue it.",
      "supportingExcerpt": "previa autorización del Servicio Nacional de Migración"
    }
  ],
  "policies": [
    {
      "id": "dprk-ordinary-passport-panama-authorized-visa-2026",
      "title": "North Korean ordinary passports: Panama authorized visa required",
      "summary": "Panama's current Embassy visitor schedule separately lists the Republic of Korea as visa-free and the People's Republic of Korea in the authorized-visa cohort. In that paired context the latter maps to North Korea, whose ordinary-passport visitor must obtain consular issuance after Migration Service authorization before travel.",
      "status": "visa_required",
      "destinationCodes": ["PA"],
      "passportCodes": ["KP"],
      "conditions": [
        "Applies to a standard North Korean ordinary passport used for a short visitor trip; diplomatic, official, service, residence, work, transit and other special-document routes remain outside scope.",
        "The applicant must appear in person at the Panamanian consulate. The authorized-visa approval process may take up to 60 business days, and travel should not be finalized until the visa is granted.",
        "A traveller holding a qualifying valid visa or residence from the countries named in Panama's Executive Decree 521 exception may use that conditional waiver instead; it is not the unconditional passport baseline.",
        "Migration Service authorization and consular issuance do not guarantee final admission at the border."
      ],
      "sourceIds": [
        "panama-embassy-live-authorized-visa-schedule-2026",
        "panama-mire-authorized-visa-preauthorization-2026"
      ],
      "confidence": "medium"
    }
  ],
  "conflicts": [],
  "unresolved": [
    {"passportCode":"TW","destinationCode":"GE","reason":"Taiwan's passport authority says Taiwanese travellers cannot use Georgia's eVisa and describes only event-invitation entry permission; no ordinary tourist issuing route is established.","searchedOfficialDomains":["evisa.gov.ge","matsne.gov.ge","boca.gov.tw"]},
    {"passportCode":"XK","destinationCode":"GE","reason":"Georgia's current eVisa selector and named cohort omit Kosovo but do not establish recognition, a replacement consular route or an omission-based result.","searchedOfficialDomains":["evisa.gov.ge","matsne.gov.ge","mfa-ks.net"]},
    {"passportCode":"RS","destinationCode":"ZM","reason":"Zambia's live roster retains the legacy label Serbia and Montenegro, while Serbia's current Foreign Ministry page contradicts itself between arrival visa and visa-free treatment.","searchedOfficialDomains":["zambiaimmigration.gov.zm","mfa.gov.rs"]},
    {"passportCode":"XK","destinationCode":"ZM","reason":"Kosovo appears in none of Zambia's named no-visa, arrival-or-mission, or prior-approval cohorts; no current authority supplies recognition or an issuance result.","searchedOfficialDomains":["zambiaimmigration.gov.zm","mfa-ks.net"]},
    {"passportCode":"XK","destinationCode":"LK","reason":"Sri Lanka's current alert names Kosovo but mandates a sponsor/head-office application without identifying issuance form or timing and conflicts with the general ETA presentation.","searchedOfficialDomains":["eta.gov.lk","immigration.gov.lk","mfa-ks.net"]},
    {"passportCode":"SY","destinationCode":"LK","reason":"Sri Lanka's current alert names Syria but mandates a sponsor/head-office application without identifying issuance form or timing and conflicts with the general ETA presentation.","searchedOfficialDomains":["eta.gov.lk","immigration.gov.lk","mofaex.gov.sy"]},
    {"passportCode":"IL","destinationCode":"YE","reason":"Yemen's current embassy-sticker framework is purpose and sponsor conditioned and does not establish Israeli-passport recognition or eligibility; outbound Israeli restrictions are not destination admission.","searchedOfficialDomains":["yemenevisa.org","gov.il"]},
    {"passportCode":"XK","destinationCode":"YE","reason":"Yemen's generic embassy-sticker framework provides no current Kosovo-passport recognition or nationality-specific visitor eligibility result.","searchedOfficialDomains":["yemenevisa.org","mfa-ks.net"]},
    {"passportCode":"CN","destinationCode":"TW","reason":"Taiwan's current rules use a separate Mainland travel document and entry permit with residence, study, work or family qualifications, not a Chinese ordinary-passport baseline.","searchedOfficialDomains":["immigration.gov.tw","boca.gov.tw"]},
    {"passportCode":"PS","destinationCode":"TW","reason":"Taiwan's visa law requires a passport recognized or accepted by the ROC, but no current authority establishes Palestinian document acceptance or a short-visitor issuing route.","searchedOfficialDomains":["boca.gov.tw","immigration.gov.tw"]},
    {"passportCode":"AD","destinationCode":"GT","reason":"Guatemala's live Foreign Ministry schedule places Andorra ordinary passports in both Category A visa-exempt and Category B consular-visa cohorts.","searchedOfficialDomains":["minex.gob.gt","igm.gob.gt","cocesna.org"]},
    {"passportCode":"HK","destinationCode":"GT","reason":"Guatemala's British-document notation does not directly classify a standard HKSAR passport, and no current authority supplies the missing exact mapping.","searchedOfficialDomains":["minex.gob.gt","igm.gob.gt","cocesna.org"]},
    {"passportCode":"MO","destinationCode":"GT","reason":"Guatemala's current official schedules do not directly map a standard Macao SAR passport and state no safe residual consequence.","searchedOfficialDomains":["minex.gob.gt","igm.gob.gt","cocesna.org"]},
    {"passportCode":"XK","destinationCode":"GT","reason":"Guatemala's current official schedules do not directly map a standard Kosovo passport or establish recognition and issuance.","searchedOfficialDomains":["minex.gob.gt","igm.gob.gt","cocesna.org"]},
    {"passportCode":"SS","destinationCode":"GT","reason":"Guatemala's current schedules do not directly map the distinct state of South Sudan, and Sudan wording is not transferred to it.","searchedOfficialDomains":["minex.gob.gt","igm.gob.gt","cocesna.org"]},
    {"passportCode":"MO","destinationCode":"PA","reason":"Panama's live Embassy schedule does not name Macao, and the conditional third-country-document waiver does not establish the unconditional ordinary-passport baseline.","searchedOfficialDomains":["embassyofpanama.org","mire.gob.pa","migracion.gob.pa"]},
    {"passportCode":"TL","destinationCode":"PA","reason":"Panama's live Embassy schedule does not name Timor-Leste, and no current official complement establishes its unconditional visitor route.","searchedOfficialDomains":["embassyofpanama.org","mire.gob.pa","migracion.gob.pa"]},
    {"passportCode":"SS","destinationCode":"PA","reason":"Panama's live Embassy schedule names Sudan but not the distinct state of South Sudan; no current source establishes a South Sudanese ordinary-passport route.","searchedOfficialDomains":["embassyofpanama.org","mire.gob.pa","migracion.gob.pa"]}
  ]
}
