{
  "batchId": "marshall-islands-bilateral-proof-cohort-b2-2026",
  "researchedAt": "2026-08-24",
  "sources": [
    {
      "id": "rmi-embassy-current-consular-diplomatic-ties-visa-guidance",
      "title": "Embassy of the Republic of the Marshall Islands: current consular visa information",
      "url": "https://www.rmiembassyus.org/consular",
      "publisher": "Embassy of the Republic of the Marshall Islands, Washington, D.C.",
      "jurisdiction": "Republic of the Marshall Islands",
      "kind": "government-guidance",
      "language": "English",
      "reviewedAt": "2026-08-24",
      "officialityEvidence": "The live RMI Embassy consular page states the current ordinary-visitor A/B/C partition: named exemptions, diplomatic-relations visa on arrival, and a prior-visa residual.",
      "supportingExcerpt": "Citizens from ALL OTHER countries not listed in A or B above must apply for visa PRIOR TO traveling to the Republic."
    }
  ],
  "policies": [],
  "conflicts": [],
  "unresolved": [
    {
      "passportCode": "NE",
      "destinationCode": "MH",
      "reason": "The current RMI rule makes arrival issuance depend on diplomatic relations. No current official RMI or Nigerien record directly proves relations or proves they have not been established; no result is inferred from omissions or historical lists.",
      "searchedOfficialDomains": ["rmiembassyus.org", "diplomatie.gouv.ne", "gouv.ne", "rmiparliament.org"]
    },
    {
      "passportCode": "TG",
      "destinationCode": "MH",
      "reason": "The current RMI rule makes arrival issuance depend on diplomatic relations. No current official RMI or Togolese record directly proves relations or proves they have not been established; no result is inferred from omissions or historical lists.",
      "searchedOfficialDomains": ["rmiembassyus.org", "diplomatie.gouv.tg", "rmiparliament.org"]
    },
    {
      "passportCode": "GN",
      "destinationCode": "MH",
      "reason": "The current RMI rule makes arrival issuance depend on diplomatic relations. No current official RMI or Guinean record directly proves relations or proves they have not been established; no result is inferred from omissions or historical lists.",
      "searchedOfficialDomains": ["rmiembassyus.org", "diplomatie.gov.gn", "rmiparliament.org"]
    },
    {
      "passportCode": "MR",
      "destinationCode": "MH",
      "reason": "The current RMI rule makes arrival issuance depend on diplomatic relations. No current official RMI or Mauritanian record directly proves relations or proves they have not been established; no result is inferred from omissions or historical lists.",
      "searchedOfficialDomains": ["rmiembassyus.org", "diplomatie.gov.mr", "rmiparliament.org"]
    },
    {
      "passportCode": "GQ",
      "destinationCode": "MH",
      "reason": "The current RMI rule makes arrival issuance depend on diplomatic relations. No current official RMI or Equatorial Guinean record directly proves relations or proves they have not been established; no result is inferred from omissions or historical lists.",
      "searchedOfficialDomains": ["rmiembassyus.org", "mae.gov.gq", "rmiparliament.org"]
    },
    {
      "passportCode": "TD",
      "destinationCode": "MH",
      "reason": "The current RMI rule makes arrival issuance depend on diplomatic relations. No current official RMI or Chadian record directly proves relations or proves they have not been established; no result is inferred from omissions or historical lists.",
      "searchedOfficialDomains": ["rmiembassyus.org", "diplomatie.gouv.td", "rmiparliament.org"]
    },
    {
      "passportCode": "ML",
      "destinationCode": "MH",
      "reason": "The current RMI rule makes arrival issuance depend on diplomatic relations. No current official RMI or Malian record directly proves relations or proves they have not been established; no result is inferred from omissions or historical lists.",
      "searchedOfficialDomains": ["rmiembassyus.org", "mae.gov.ml", "rmiparliament.org"]
    },
    {
      "passportCode": "KM",
      "destinationCode": "MH",
      "reason": "The current RMI rule makes arrival issuance depend on diplomatic relations. No current official RMI or Comorian record directly proves relations or proves they have not been established; no result is inferred from omissions or historical lists.",
      "searchedOfficialDomains": ["rmiembassyus.org", "diplomatie.gouv.km", "rmiparliament.org"]
    },
    {
      "passportCode": "GW",
      "destinationCode": "MH",
      "reason": "The current RMI rule makes arrival issuance depend on diplomatic relations. No current official RMI or Guinea-Bissau record directly proves relations or proves they have not been established; no result is inferred from omissions or historical lists.",
      "searchedOfficialDomains": ["rmiembassyus.org", "mne.gov.gw", "rmiparliament.org"]
    },
    {
      "passportCode": "AO",
      "destinationCode": "MH",
      "reason": "The current RMI rule makes arrival issuance depend on diplomatic relations. No current official RMI or Angolan record directly proves relations or proves they have not been established; no result is inferred from omissions or historical lists.",
      "searchedOfficialDomains": ["rmiembassyus.org", "mirex.gov.ao", "rmiparliament.org"]
    },
    {
      "passportCode": "CG",
      "destinationCode": "MH",
      "reason": "The current RMI rule makes arrival issuance depend on diplomatic relations. No current official RMI or Republic of the Congo record directly proves relations or proves they have not been established; no result is inferred from omissions or historical lists.",
      "searchedOfficialDomains": ["rmiembassyus.org", "mae.gov.cg", "rmiparliament.org"]
    },
    {
      "passportCode": "BT",
      "destinationCode": "MH",
      "reason": "The current RMI rule makes arrival issuance depend on diplomatic relations. No current official RMI or Bhutanese record directly proves relations or proves they have not been established; no result is inferred from omissions or historical lists.",
      "searchedOfficialDomains": ["rmiembassyus.org", "mfa.gov.bt", "rmiparliament.org"]
    }
  ]
}
