{
  "batchId": "maldives-cambodia-nicaragua-tanzania-current-entry-2026",
  "researchedAt": "2026-08-24",
  "sources": [
    {
      "id": "maldives-mfa-cambodia-ordinary-passport-waiver-effective-2023",
      "title": "Visa Exemption for Maldivians travelling to Cambodia",
      "url": "https://foreign.gov.mv/index.php/en/media-center/news/visa-exemption-for-maldivians-travelling-to-cambodia",
      "publisher": "Ministry of Foreign Affairs of the Republic of Maldives",
      "jurisdiction": "Maldives",
      "kind": "government-guidance",
      "language": "English",
      "reviewedAt": "2026-08-24",
      "officialityEvidence": "The live Maldivian Foreign Ministry notice directly states the effective date, passport classes and maximum stay for Cambodia's bilateral visa exemption.",
      "supportingExcerpt": "Maldivians holding valid Diplomatic, Official and Ordinary passports to enter and stay in Cambodia a maximum period of thirty (30) days"
    },
    {
      "id": "tanzania-immigration-current-visa-guidelines-nationality-routes",
      "title": "Tanzania Visa Guidelines",
      "url": "https://immigration.go.tz/index.php/regulations?download=15%3Avisa-gui",
      "publisher": "Tanzania Immigration Department",
      "jurisdiction": "Tanzania",
      "kind": "government-guidance",
      "language": "English",
      "reviewedAt": "2026-08-24",
      "officialityEvidence": "Tanzania Immigration's live official guidance gives the operative nationality lists and distinguishes online issuance from arrival issuance.",
      "supportingExcerpt": "Nationals from the listed countries below are eligible for both Online as well as on arrival Visa facility."
    }
  ],
  "policies": [
    {
      "id": "maldivian-ordinary-passports-cambodia-visa-free-2026",
      "title": "Maldivian ordinary passports: Cambodia visa-free short visits",
      "summary": "The current Maldivian MFA guidance says the bilateral Cambodian visa exemption took effect on 4 May 2023 and covers ordinary passports for up to 30 days.",
      "status": "visa_free",
      "destinationCodes": ["KH"],
      "passportCodes": ["MV"],
      "conditions": [
        "Applies to a valid Maldivian ordinary passport for entry, transit, stay and departure of no more than 30 days from entry.",
        "A longer stay, work, study or business requires an appropriate visa before travel.",
        "Final immigration admission and ordinary entry-document requirements remain applicable."
      ],
      "sourceIds": ["maldives-mfa-cambodia-ordinary-passport-waiver-effective-2023"],
      "confidence": "high"
    }
  ],
  "conflicts": [],
  "unresolved": [
    {
      "passportCode": "NI",
      "destinationCode": "TZ",
      "reason": "Tanzania Immigration's current guidance makes visa-on-arrival eligibility a named-nationality list and distinguishes it from online and referral routes. It provides no direct current ordinary Nicaraguan-passport result; neither the generic portal nor the list's omission is used to infer visa-on-arrival or advance issuance.",
      "searchedOfficialDomains": ["immigration.go.tz", "visa.immigration.go.tz", "cancilleria.gob.ni"]
    }
  ]
}
