{
  "batchId": "barbados-maldives-final-gap-2026",
  "researchedAt": "2026-08-24",
  "sources": [
    {
      "id": "maldives-mfa-barbados-ordinary-passport-visitor-2026",
      "title": "Visa Information: Barbados",
      "url": "https://foreign.gov.mv/index.php/en/consular/for-maldivian/visa-information/visa/barbados",
      "publisher": "Ministry of Foreign Affairs, Republic of Maldives",
      "jurisdiction": "Maldives",
      "kind": "government-guidance",
      "language": "English",
      "reviewedAt": "2026-08-24",
      "officialityEvidence": "The Maldives Foreign Ministry's live country-specific consular page directly states the Barbados treatment for Maldivian passport holders and links Barbados Immigration for further details.",
      "supportingExcerpt": "Maldivian passport holders are exempt from the visa requirement when visiting Barbados for a short-term stay of up to 6 months."
    }
  ],
  "policies": [
    {
      "id": "maldivian-ordinary-passport-barbados-short-visitor-waiver-2026",
      "title": "Maldivian ordinary passports: Barbados short-visitor visa waiver",
      "summary": "The Maldives Foreign Ministry's current Barbados-specific guidance exempts Maldivian passport holders from the visa requirement for short stays up to six months.",
      "status": "visa_free",
      "destinationCodes": ["BB"],
      "passportCodes": ["MV"],
      "conditions": [
        "Applies to an ordinary Maldivian passport holder visiting Barbados for a short stay of up to six months.",
        "The cited guidance establishes visa exemption only; employment, residence, study, transit, crew, diplomatic, official and special-document treatment are outside scope.",
        "The source directs travellers to Barbados Immigration for additional current entry requirements and final admission remains outside this visa classification."
      ],
      "sourceIds": ["maldives-mfa-barbados-ordinary-passport-visitor-2026"],
      "confidence": "medium"
    }
  ],
  "conflicts": [],
  "unresolved": []
}
