{
  "batchId": "estonia-final-outbound-gaps-2026",
  "researchedAt": "2026-08-23",
  "sources": [
    {
      "id": "jordan-tourism-board-estonia-arrival-visa-2026",
      "title": "Visas To Jordan",
      "url": "https://fr.visitjordan.com/page/4/visas-to-jordan/",
      "publisher": "Jordan Tourism Board",
      "jurisdiction": "Jordan",
      "kind": "government-guidance",
      "language": "English",
      "reviewedAt": "2026-08-23",
      "officialityEvidence": "The page identifies visitjordan.com as the official Jordan Tourism Board site and publishes its nationality-by-nationality arrival-visa table.",
      "supportingExcerpt": "Estonia | Applicable | Visa can be obtained upon arrival, it will cost a total of 40 JOD."
    }
  ],
  "policies": [
    {
      "id": "estonian-ordinary-passport-jordan-arrival-visa-2026",
      "title": "Estonian ordinary passports: Jordan visitor visa on arrival",
      "summary": "Jordan's official Tourism Board table expressly makes a visa available to Estonian nationals on arrival for 40 JOD.",
      "status": "visa_on_arrival",
      "destinationCodes": ["JO"],
      "passportCodes": ["EE"],
      "conditions": [
        "The listed visa is obtained on arrival and costs 40 JOD.",
        "Jordan's table says all non-Jordanians must register on Gateway2Jordan before departure for a QR code.",
        "Work, residence, special travel documents, entry-point limits, carrier checks and final admission remain separate."
      ],
      "sourceIds": ["jordan-tourism-board-estonia-arrival-visa-2026"],
      "confidence": "medium"
    }
  ],
  "conflicts": [],
  "unresolved": [
    {
      "passportCode": "EE",
      "destinationCode": "AF",
      "reason": "No current Afghan or Estonian authority establishes a usable ordinary Estonian-passport visitor route and actual issuance timing; operational restrictions are not a taxonomy result.",
      "searchedOfficialDomains": ["reisitargalt.vm.ee", "mfa.gov.af", "moi.gov.af"]
    },
    {
      "passportCode": "EE",
      "destinationCode": "BD",
      "reason": "No current Bangladesh or Estonian authority establishes an ordinary Estonian visitor visa issued at arrival; portal and mission material do not prove this passport's route.",
      "searchedOfficialDomains": ["reisitargalt.vm.ee", "visa.gov.bd", "mofa.gov.bd"]
    },
    {
      "passportCode": "EE",
      "destinationCode": "BW",
      "reason": "No current Botswana or Estonian authority establishes the ordinary Estonian visitor exemption without inferring a complement from a visa-required service.",
      "searchedOfficialDomains": ["reisitargalt.vm.ee", "gov.bw", "immigration.gov.bw"]
    },
    {
      "passportCode": "EE",
      "destinationCode": "VG",
      "reason": "No current British Virgin Islands authority establishes an ordinary Estonian visitor baseline; conditional third-country-document waivers are excluded.",
      "searchedOfficialDomains": ["reisitargalt.vm.ee", "bvi.gov.vg", "laws.gov.vg"]
    },
    {
      "passportCode": "EE",
      "destinationCode": "BF",
      "reason": "Current Burkina Faso sources do not establish ordinary Estonian-passport electronic or mission-visa eligibility and actual issuance timing.",
      "searchedOfficialDomains": ["reisitargalt.vm.ee", "diplomatie.gov.bf", "visaburkina.bf"]
    },
    {
      "passportCode": "EE",
      "destinationCode": "CF",
      "reason": "No current Central African Republic or Estonian authority establishes an ordinary Estonian-passport visitor channel and actual issuance timing.",
      "searchedOfficialDomains": ["reisitargalt.vm.ee", "diplomatie.gouv.cf", "interieur.gouv.cf"]
    },
    {
      "passportCode": "EE",
      "destinationCode": "TD",
      "reason": "Chad's eVisa surface lacks independent current government evidence establishing ordinary Estonian-passport eligibility and actual electronic issuance.",
      "searchedOfficialDomains": ["reisitargalt.vm.ee", "diplomatie.gouv.td", "evisa.td"]
    },
    {
      "passportCode": "EE",
      "destinationCode": "KM",
      "reason": "Comorian entry law requires a visa subject to conventions and special laws, but no current Estonian nationality schedule establishes advance, electronic or arrival issuance.",
      "searchedOfficialDomains": ["reisitargalt.vm.ee", "justice.gouv.km", "gouv.km"]
    },
    {
      "passportCode": "EE",
      "destinationCode": "CG",
      "reason": "No current Republic of the Congo or Estonian authority establishes ordinary Estonian-passport visitor eligibility and actual issuance timing.",
      "searchedOfficialDomains": ["reisitargalt.vm.ee", "diplomatie.gouv.cg", "dgrsp.cg"]
    },
    {
      "passportCode": "EE",
      "destinationCode": "CI",
      "reason": "Côte d'Ivoire's process describes online pre-enrolment and airport biometric printing, but not ordinary Estonian-passport eligibility for that route.",
      "searchedOfficialDomains": ["reisitargalt.vm.ee", "snedai.com", "diplomatie.gouv.ci"]
    },
    {
      "passportCode": "EE",
      "destinationCode": "DJ",
      "reason": "Djibouti's electronic service does not publish a current ordinary Estonian-passport eligibility result or exemption schedule.",
      "searchedOfficialDomains": ["reisitargalt.vm.ee", "evisa.gouv.dj", "egouv.dj"]
    },
    {
      "passportCode": "EE",
      "destinationCode": "GW",
      "reason": "No current Guinea-Bissau or Estonian authority establishes whether an ordinary Estonian visitor is issued a visa at a mission, electronically or at arrival.",
      "searchedOfficialDomains": ["reisitargalt.vm.ee", "mne.gw", "gov.gw"]
    },
    {
      "passportCode": "EE",
      "destinationCode": "IR",
      "reason": "Estonian Foreign Ministry guidance says Estonian citizens need an Iranian visa but does not establish whether ordinary visitor issuance is advance, electronic or at arrival.",
      "searchedOfficialDomains": ["reisitargalt.vm.ee", "evisa.mfa.ir", "mfa.ir"]
    },
    {
      "passportCode": "EE",
      "destinationCode": "LR",
      "reason": "Liberia's arrival process is residence- and pre-approval-dependent; no current source maps an ordinary Estonian passport to an unconditional visitor route.",
      "searchedOfficialDomains": ["reisitargalt.vm.ee", "immigration.gov.lr", "visaonarrival.lis.gov.lr"]
    },
    {
      "passportCode": "EE",
      "destinationCode": "ML",
      "reason": "No current Malian or Estonian authority establishes ordinary Estonian-passport visitor eligibility and actual issuance timing.",
      "searchedOfficialDomains": ["reisitargalt.vm.ee", "diplomatiemdc.gouv.ml", "securite.gouv.ml"]
    },
    {
      "passportCode": "EE",
      "destinationCode": "NE",
      "reason": "Niger's general visitor framework preserves bilateral and community exemptions, but no current ordinary Estonian-passport schedule establishes a visitor route.",
      "searchedOfficialDomains": ["reisitargalt.vm.ee", "diplomatie.gouv.ne", "interieur.gouv.ne"]
    },
    {
      "passportCode": "EE",
      "destinationCode": "KP",
      "reason": "No current DPRK or Estonian authority establishes a usable ordinary Estonian-passport visitor route; access restrictions are not taxonomy states.",
      "searchedOfficialDomains": ["reisitargalt.vm.ee", "mfa.gov.kp", "naenara.com.kp"]
    },
    {
      "passportCode": "EE",
      "destinationCode": "PS",
      "reason": "Israeli crossing, permit and operational controls do not establish a Palestinian-Territory ordinary Estonian-passport visa or ETA status.",
      "searchedOfficialDomains": ["reisitargalt.vm.ee", "mofa.pna.ps", "gov.il", "cogat.mod.gov.il"]
    },
    {
      "passportCode": "EE",
      "destinationCode": "SL",
      "reason": "Estonian MFA confirms that Estonian citizens need a Sierra Leone visa but does not establish actual issuance timing; official eVisa and arrival surfaces are not reconciled for this passport.",
      "searchedOfficialDomains": ["reisitargalt.vm.ee", "slid.gov.sl", "evisa.sl"]
    },
    {
      "passportCode": "EE",
      "destinationCode": "SS",
      "reason": "South Sudan's electronic service does not publish ordinary Estonian-passport eligibility and describes both downloadable approval and port-of-entry visa stamping.",
      "searchedOfficialDomains": ["reisitargalt.vm.ee", "evisa.gov.ss", "mofaic.gov.ss"]
    },
    {
      "passportCode": "EE",
      "destinationCode": "SD",
      "reason": "No current Sudanese or Estonian authority establishes ordinary Estonian-passport visitor issuance timing among mission, electronic and counter-visa processes.",
      "searchedOfficialDomains": ["reisitargalt.vm.ee", "mofa.gov.sd", "passports.gov.sd"]
    },
    {
      "passportCode": "EE",
      "destinationCode": "SY",
      "reason": "No current Syrian or Estonian authority establishes ordinary Estonian-passport visitor eligibility and actual issuance timing; online application wording is not normalized.",
      "searchedOfficialDomains": ["reisitargalt.vm.ee", "mofaex.gov.sy", "moi.gov.sy", "gaca.gov.sy"]
    },
    {
      "passportCode": "EE",
      "destinationCode": "TM",
      "reason": "Turkmen visitor routes depend on invitation or other preapproval, but no current source distinguishes an ordinary Estonian passport's baseline issuance timing.",
      "searchedOfficialDomains": ["reisitargalt.vm.ee", "migration.gov.tm", "mfa.gov.tm"]
    }
  ]
}
