{
  "batchId": "pass373-saudi-current-route-adjudication-2026",
  "researchedAt": "2026-08-26",
  "sources": [
    {
      "id": "saudi-refresh-visa-regulations-country-groups-api",
      "title": "Visit Saudi visa regulations: live country groups",
      "url": "https://www.visitsaudi.com/bin/api/v1/geo/countries?locale=en",
      "publisher": "Saudi Tourism Authority",
      "jurisdiction": "Saudi Arabia",
      "kind": "official-dataset",
      "language": "English",
      "reviewedAt": "2026-08-26",
      "officialityEvidence": "The live Visit Saudi country-group dataset is served by the Saudi Tourism Authority official tourism domain and is the current nationality selector used by Visit Saudi visa regulations.",
      "supportingExcerpt": "Bangladesh ... visaGroup: Visa by Package"
    },
    {
      "id": "saudi-refresh-visa-regulations-routes-api",
      "title": "Visit Saudi visa regulations: live route configuration",
      "url": "https://www.visitsaudi.com/bin/api/v2/evisa/config?locale=en",
      "publisher": "Saudi Tourism Authority",
      "jurisdiction": "Saudi Arabia",
      "kind": "official-portal",
      "language": "English",
      "reviewedAt": "2026-08-26",
      "officialityEvidence": "The live Visit Saudi route configuration is served by the Saudi Tourism Authority official tourism domain and defines the available visitor routes for each current visa group and selected qualification answer.",
      "supportingExcerpt": "The following documents are also required to obtain an Embassy/Consulate/Tasheer visa"
    }
  ],
  "policies": [
    {
      "id": "pass373-saudi-noneligible-other-answer-advance-visa-2026",
      "title": "Saudi ordinary visitor route for the current noneligible nationality cohort",
      "summary": "Visit Saudi's live country selector maps these passports to its noneligible group. For an ordinary visitor without qualifying third-country visa or residence documents, the selection-specific OTHER result requires an advance Embassy, Consulate or Tasheer visa.",
      "status": "visa_required",
      "destinationCodes": ["SA"],
      "passportCodes": ["CL", "AR", "VC", "UY", "AG", "VA", "CR", "PY", "LC", "PE", "TT", "DM", "SB", "WS", "GT", "SV", "MH", "TO", "TV", "CO", "HN", "NI", "KI", "FM", "MK", "PW", "BA", "VE", "MD", "TL", "BZ", "EC", "FJ", "NR", "XK", "VU", "GY", "JM", "PG", "BO", "BW", "BY", "SR", "LS", "DO", "NA", "MA", "SZ", "GH", "KE", "MW", "TZ", "GM", "RW", "PH", "TN", "AM", "MN", "ZM", "CV", "MZ", "UG", "SL", "BJ", "ST", "ZW", "BF", "CI", "CU", "MG", "SN", "NE", "TG", "GA", "GN", "MR", "GQ", "ML", "GW", "VN", "DZ", "KM", "AO", "KH", "CM", "LR", "BT", "CF", "HT", "LA", "BI", "TM", "LB", "CD", "DJ", "MM", "NG", "LK", "ER", "KP", "SS", "SD", "NP", "SO", "YE", "IQ", "SY", "AF"],
      "conditions": [
        "Ordinary passport and short tourism baseline without a qualifying U.S., U.K. or Schengen business/tourist visa or residence permit, GCC residence, integrated travel package, pilgrimage route or airline stopover product.",
        "The live official nationality record maps each named passport to visaGroup noneligible. The selection-specific OTHER response then presents Embassy/Consulate/Tasheer visa requirements and the Saudi Foreign Ministry embassy finder.",
        "The advance application requires a passport valid at least six months beyond entry, proof of residence, return ticket, employment and financial evidence, itinerary, identification and a Saudi accommodation address.",
        "Conditional eVisa or visa-on-arrival routes for qualifying third-country visa or residence holders do not replace this ordinary passport-only baseline. Issuance and final admission remain discretionary."
      ],
      "sourceIds": ["saudi-refresh-visa-regulations-country-groups-api", "saudi-refresh-visa-regulations-routes-api"],
      "confidence": "high"
    },
    {
      "id": "pass373-saudi-six-nationality-package-tourist-evisa-2026",
      "title": "Saudi package tourist eVisa for six current nationalities",
      "summary": "Visit Saudi's live selector maps these six passports to Visa by Package. Its selection-specific OTHER result offers an instant tourist eVisa through integrated packages from qualified travel agencies.",
      "status": "evisa",
      "destinationCodes": ["SA"],
      "passportCodes": ["ID", "IN", "JO", "EG", "BD", "PK"],
      "conditions": [
        "The traveller must purchase an integrated package through a qualified agency, including a licensed hotel rated four stars or above, round-trip flight, online visa application and medical insurance.",
        "The published package criteria include a minimum value, a two-to-88-day duration, adult and child composition limits, and travel beginning at least 48 hours after purchase.",
        "The package route excludes Makkah and Madinah. It is not a visa exemption, visa on arrival or unsponsored electronic entitlement.",
        "Passport validity, security review, carrier checks and final admission remain separate. The standard Embassy/Consulate route remains an alternative."
      ],
      "sourceIds": ["saudi-refresh-visa-regulations-country-groups-api", "saudi-refresh-visa-regulations-routes-api"],
      "confidence": "high",
      "application": {
        "url": "https://www.visitsaudi.com/en/campaigns/package-visa",
        "label": "Visit Saudi package visa",
        "processingTime": "Travel must begin at least 48 hours after completing the package purchase.",
        "steps": [
          "Choose a qualified travel-agency package that satisfies the published hotel, flight, value and duration criteria.",
          "Complete the online visa application and medical insurance through the integrated package provider.",
          "Wait for the electronic tourist visa before travel and retain the approved travel-package documents."
        ]
      }
    }
  ],
  "conflicts": [
    {
      "passportCode": "ID",
      "destinationCode": "SA",
      "snapshotStatus": "visa_required",
      "officialStatus": "evisa",
      "explanation": "The live official country selector maps Indonesia to Visa by Package and its OTHER result expressly provides an instant tourist eVisa through an approved integrated travel package.",
      "sourceIds": ["saudi-refresh-visa-regulations-country-groups-api", "saudi-refresh-visa-regulations-routes-api"]
    },
    {
      "passportCode": "IN",
      "destinationCode": "SA",
      "snapshotStatus": "visa_required",
      "officialStatus": "evisa",
      "explanation": "The live official country selector maps India to Visa by Package and its OTHER result expressly provides an instant tourist eVisa through an approved integrated travel package.",
      "sourceIds": ["saudi-refresh-visa-regulations-country-groups-api", "saudi-refresh-visa-regulations-routes-api"]
    },
    {
      "passportCode": "JO",
      "destinationCode": "SA",
      "snapshotStatus": "visa_required",
      "officialStatus": "evisa",
      "explanation": "The live official country selector maps Jordan to Visa by Package and its OTHER result expressly provides an instant tourist eVisa through an approved integrated travel package.",
      "sourceIds": ["saudi-refresh-visa-regulations-country-groups-api", "saudi-refresh-visa-regulations-routes-api"]
    },
    {
      "passportCode": "EG",
      "destinationCode": "SA",
      "snapshotStatus": "visa_required",
      "officialStatus": "evisa",
      "explanation": "The live official country selector maps Egypt to Visa by Package and its OTHER result expressly provides an instant tourist eVisa through an approved integrated travel package.",
      "sourceIds": ["saudi-refresh-visa-regulations-country-groups-api", "saudi-refresh-visa-regulations-routes-api"]
    },
    {
      "passportCode": "BD",
      "destinationCode": "SA",
      "snapshotStatus": "visa_required",
      "officialStatus": "evisa",
      "explanation": "The live official country selector maps Bangladesh to Visa by Package and its OTHER result expressly provides an instant tourist eVisa through an approved integrated travel package.",
      "sourceIds": ["saudi-refresh-visa-regulations-country-groups-api", "saudi-refresh-visa-regulations-routes-api"]
    },
    {
      "passportCode": "PK",
      "destinationCode": "SA",
      "snapshotStatus": "visa_required",
      "officialStatus": "evisa",
      "explanation": "The live official country selector maps Pakistan to Visa by Package and its OTHER result expressly provides an instant tourist eVisa through an approved integrated travel package.",
      "sourceIds": ["saudi-refresh-visa-regulations-country-groups-api", "saudi-refresh-visa-regulations-routes-api"]
    }
  ],
  "unresolved": [
    {
      "passportCode": "IL",
      "destinationCode": "SA",
      "reason": "The current Saudi Tourism Authority country dataset contains no Israel record. Generic conditional routes do not establish recognition, eligibility or an ordinary Israeli-passport visitor baseline.",
      "searchedOfficialDomains": ["visitsaudi.com", "visa.visitsaudi.com", "ksavisa.sa", "mofa.gov.sa"]
    },
    {
      "passportCode": "CG",
      "destinationCode": "SA",
      "reason": "The dataset's single Congo label uses Democratic Republic of the Congo flag material and does not provide a reproducible Republic of the Congo crosswalk, so the current route cannot be transferred to CG.",
      "searchedOfficialDomains": ["visitsaudi.com", "visa.visitsaudi.com", "ksavisa.sa", "mofa.gov.sa"]
    }
  ]
}
